{"attribution":{"geonames":false},"components":[{"id":0,"roots":["I9001","I9002","I9006","I9014"],"size":11},{"id":1,"roots":["I9010","I9011"],"size":2},{"id":2,"roots":["I9012","I9013"],"size":2},{"id":3,"roots":["I9017"],"size":1},{"id":4,"roots":["I9018"],"size":1}],"counts":{"components":5,"edges":16,"events":36,"faces":0,"people":17,"places":3,"unions":7},"edges":[{"kind":"partner","s":"I9001","t":"I9002","type":"married","union":"F9001"},{"kind":"parent","rel":"birth","s":"I9001","t":"I9003","union":"F9001"},{"kind":"parent","rel":"step","s":"I9001","t":"I9004","union":"F9001"},{"kind":"parent","rel":"foster","s":"I9001","t":"I9005","union":"F9001"},{"kind":"parent","rel":"adopted","s":"I9002","t":"I9003","union":"F9001"},{"kind":"parent","rel":"step","s":"I9002","t":"I9004","union":"F9001"},{"kind":"parent","rel":"sponsored","s":"I9002","t":"I9005","union":"F9001"},{"kind":"partner","s":"I9002","t":"I9006","type":"unmarried","union":"F9002"},{"kind":"parent","rel":"unknown","s":"I9002","t":"I9007","union":"F9002"},{"kind":"parent","rel":"custom","s":"I9002","t":"I9008","union":"F9002"},{"kind":"parent","rel":"birth","s":"I9003","t":"I9009","union":"F9003"},{"kind":"partner","s":"I9005","t":"I9014","type":"custom","union":"F9006"},{"kind":"parent","rel":"none","s":"I9006","t":"I9007","union":"F9002"},{"kind":"parent","rel":"birth","s":"I9006","t":"I9008","union":"F9002"},{"kind":"parent","rel":"birth","s":"I9006","t":"I9016","union":"F9007"},{"kind":"partner","s":"I9012","t":"I9013","type":"civil_union","union":"F9005"}],"events":[{"person":"I9001","place":"P9002","type":"birth","year":1880},{"person":"I9001","place":null,"type":"other","year":1899},{"person":"I9001","place":"P9002","type":"marriage","year":1903},{"person":"I9001","place":null,"type":"occupation","year":1910},{"person":"I9001","place":"P9002","type":"residence","year":1920},{"person":"I9001","place":"P9002","type":"death","year":1950},{"person":"I9002","place":null,"type":"birth","year":1878},{"person":"I9002","place":"P9002","type":"marriage","year":1903},{"person":"I9002","place":null,"type":"burial","year":1949},{"person":"I9002","place":null,"type":"death","year":1949},{"person":"I9003","place":"P9002","type":"birth","year":1905},{"person":"I9003","place":"P9002","type":"graduation","year":1923},{"person":"I9003","place":"P9007","type":"death","year":1990},{"person":"I9004","place":null,"type":"birth","year":1908},{"person":"I9004","place":null,"type":"death","year":null},{"person":"I9005","place":null,"type":"birth","year":1910},{"person":"I9005","place":null,"type":"divorce","year":1965},{"person":"I9005","place":null,"type":"death","year":1999},{"person":"I9006","place":null,"type":"birth","year":1885},{"person":"I9006","place":null,"type":"death","year":1960},{"person":"I9007","place":null,"type":"birth","year":1912},{"person":"I9007","place":null,"type":"death","year":1980},{"person":"I9008","place":null,"type":"birth","year":1915},{"person":"I9008","place":null,"type":"death","year":2001},{"person":"I9009","place":"P9002","type":"birth","year":1995},{"person":"I9010","place":null,"type":"birth","year":1930},{"person":"I9010","place":null,"type":"death","year":2005},{"person":"I9011","place":null,"type":"birth","year":1932},{"person":"I9012","place":null,"type":"birth","year":1960},{"person":"I9013","place":null,"type":"birth","year":1962},{"person":"I9014","place":null,"type":"divorce","year":1965},{"person":"I9014","place":null,"type":"death","year":2020},{"person":"I9014","place":null,"type":"birth","year":null},{"person":"I9016","place":"P9002","type":"birth","year":1925},{"person":"I9016","place":null,"type":"death","year":2010},{"person":"I9018","place":null,"type":"birth","year":1970}],"generatedAt":"2026-10-20T18:04:00Z","generations":[{"component":0,"levels":[["I9002","I9001","I9006"],["I9003","I9004","I9005","I9007","I9008","I9016","I9014"],["I9009"]]},{"component":1,"levels":[["I9010","I9011"]]},{"component":2,"levels":[["I9012","I9013"]]},{"component":3,"levels":[["I9017"]]},{"component":4,"levels":[["I9018"]]}],"minor":0,"people":[{"birthPlace":"P9002","birthYear":1880,"component":0,"deathPlace":"P9002","deathYear":1950,"face":null,"generation":0,"given":"Ada","id":"I9001","living":false,"name":"Ada Example","sex":"f","surname":"Example","yearApprox":false},{"birthPlace":null,"birthYear":1878,"component":0,"deathPlace":null,"deathYear":1949,"face":null,"generation":0,"given":"Ben","id":"I9002","living":false,"name":"Ben Example","sex":"m","surname":"Example","yearApprox":true},{"birthPlace":"P9002","birthYear":1905,"component":0,"deathPlace":"P9007","deathYear":1990,"face":null,"generation":1,"given":"Cleo","id":"I9003","living":false,"name":"Cleo Example","sex":"f","surname":"Example","yearApprox":false},{"birthPlace":null,"birthYear":1908,"component":0,"deathPlace":null,"deathYear":null,"face":null,"generation":1,"given":"Cyrus","id":"I9004","living":false,"name":"Cyrus Example","sex":"m","surname":"Example","yearApprox":true},{"birthPlace":null,"birthYear":1910,"component":0,"deathPlace":null,"deathYear":1999,"face":null,"generation":1,"given":"Dina","id":"I9005","living":false,"name":"Dina Example","sex":"u","surname":"Example","yearApprox":true},{"birthPlace":null,"birthYear":1885,"component":0,"deathPlace":null,"deathYear":1960,"face":null,"generation":0,"given":"Edith","id":"I9006","living":false,"name":"Edith Sample","sex":"f","surname":"Sample","yearApprox":false},{"birthPlace":null,"birthYear":1912,"component":0,"deathPlace":null,"deathYear":1980,"face":null,"generation":1,"given":"Eli","id":"I9007","living":false,"name":"Eli Sample","sex":"m","surname":"Sample","yearApprox":false},{"birthPlace":null,"birthYear":1915,"component":0,"deathPlace":null,"deathYear":2001,"face":null,"generation":1,"given":"Faye","id":"I9008","living":false,"name":"Faye Sample","sex":"f","surname":"Sample","yearApprox":false},{"birthPlace":"P9002","birthYear":1995,"component":0,"deathPlace":null,"deathYear":null,"face":null,"generation":2,"given":"Gus","id":"I9009","living":true,"name":"Gus Example","sex":"m","surname":"Example","yearApprox":false},{"birthPlace":null,"birthYear":1930,"component":1,"deathPlace":null,"deathYear":2005,"face":null,"generation":0,"given":"Hana","id":"I9010","living":false,"name":"Hana Lone","sex":"f","surname":"Lone","yearApprox":false},{"birthPlace":null,"birthYear":1932,"component":1,"deathPlace":null,"deathYear":null,"face":null,"generation":0,"given":"Ivo","id":"I9011","living":true,"name":"Ivo Lone","sex":"m","surname":"Lone","yearApprox":false},{"birthPlace":null,"birthYear":1960,"component":2,"deathPlace":null,"deathYear":null,"face":null,"generation":0,"given":"Jo","id":"I9012","living":true,"name":"Jo Pair","sex":"u","surname":"Pair","yearApprox":false},{"birthPlace":null,"birthYear":1962,"component":2,"deathPlace":null,"deathYear":null,"face":null,"generation":0,"given":"Kit","id":"I9013","living":true,"name":"Kit Pair","sex":"u","surname":"Pair","yearApprox":false},{"birthPlace":null,"birthYear":null,"component":0,"deathPlace":null,"deathYear":2020,"face":null,"generation":1,"given":"Lee","id":"I9014","living":false,"name":"Lee Pair","sex":"m","surname":"Pair","yearApprox":false},{"birthPlace":"P9002","birthYear":1925,"component":0,"deathPlace":null,"deathYear":2010,"face":null,"generation":1,"given":"Nell","id":"I9016","living":false,"name":"Nell Sample","sex":"f","surname":"Sample","yearApprox":false},{"birthPlace":null,"birthYear":null,"component":3,"deathPlace":null,"deathYear":null,"face":null,"generation":0,"given":"","id":"I9017","living":true,"name":"unknown","sex":"u","surname":"","yearApprox":false},{"birthPlace":null,"birthYear":1970,"component":4,"deathPlace":null,"deathYear":null,"face":null,"generation":0,"given":"Orin","id":"I9018","living":true,"name":"Orin Solo","sex":"m","surname":"Solo","yearApprox":false}],"places":[{"geo":null,"id":"P9001","lat":null,"lon":null,"name":"Examplestate","parent":null,"type":"state"},{"geo":"gramps","id":"P9002","lat":40,"lon":-100.01,"name":"Riverton","parent":"P9001","type":"city"},{"geo":"gramps","id":"P9007","lat":40.5,"lon":-100.26,"name":"Lakeside","parent":"P9001","type":"village"}],"schemaVersion":1,"source":{"builder":"hfy-graph@0.1.0","kind":"jsonl","projection":1,"snapshot":"sha256:0d2e9cec"},"unions":[{"children":[{"id":"I9003","rel":{"I9001":"birth","I9002":"adopted"}},{"id":"I9004","rel":{"I9001":"step","I9002":"step"}},{"id":"I9005","rel":{"I9001":"foster","I9002":"sponsored"}}],"id":"F9001","partners":["I9001","I9002"],"type":"married"},{"children":[{"id":"I9007","rel":{"I9002":"unknown","I9006":"none"}},{"id":"I9008","rel":{"I9002":"custom","I9006":"birth"}}],"id":"F9002","partners":["I9002","I9006"],"type":"unmarried"},{"children":[{"id":"I9009","rel":{"I9003":"birth"}}],"id":"F9003","partners":["I9003"],"type":"unknown"},{"children":[{"id":"I9010","rel":{}},{"id":"I9011","rel":{}}],"id":"F9004","partners":[],"type":"unknown"},{"children":[],"id":"F9005","partners":["I9012","I9013"],"type":"civil_union"},{"children":[],"id":"F9006","partners":["I9005","I9014"],"type":"custom"},{"children":[{"id":"I9016","rel":{"I9006":"birth"}}],"id":"F9007","partners":["I9006"],"type":"married"}]}
